{
  "$schema": "https://json-schema.org/draft/2020-12/schema",
  "$id": "https://specforge.dev/schema/specforge.json",
  "title": "SpecForge Configuration",
  "description": "Configuration file for a SpecForge project. Like tsconfig.json for TypeScript, this file defines project identity, extensions and providers.",
  "type": "object",
  "required": [
    "name",
    "version"
  ],
  "properties": {
    "$schema": {
      "type": "string",
      "description": "JSON Schema reference for IDE autocomplete and validation."
    },
    "name": {
      "type": "string",
      "description": "Project name. Used in output headers and reports.",
      "minLength": 1
    },
    "version": {
      "type": "string",
      "description": "Format version of .spec files. The compiler checks compatibility.",
      "pattern": "^\\d+\\.\\d+$",
      "default": "1.0"
    },
    "spec_root": {
      "type": "string",
      "description": "Path to .spec files relative to the project root directory.",
      "default": "."
    },
    "exclude": {
      "type": "array",
      "description": "Patterns, relative to the spec root, of .spec files that are not project sources: not compiled (check, watch, the LSP and MCP), formatted or migrated, and named by no import. `*` and `?` match within one name, `**` any number of directories, `[...]` one character of a set. An entry with no slash except a trailing one matches a name at any depth (\"drafts\" leaves out drafts/a.spec and sub/drafts/b.spec); an entry with a slash at its start or in its middle is anchored at the spec root (\"/drafts\", \"sub/drafts\"); a trailing slash matches directories only. A file is left out when an entry matches its path or one of its directories.",
      "items": {
        "type": "string",
        "minLength": 1,
        "pattern": "^(?!!)(?!(.*/)?\\.{1,2}(/|$))(?!.*//).+$",
        "description": "A pattern such as \"drafts\", \"**/*.draft.spec\" or \"sub/old/\". An entry starting with ! (exclude has no negation), with a . or .. name, or with an empty name can match no source: specforge.json reports it (E069) and it is ignored."
      },
      "uniqueItems": true,
      "default": []
    },
    "strict": {
      "type": "boolean",
      "description": "When true, warnings are treated as errors.",
      "default": false
    },
    "namespace": {
      "type": "string",
      "description": "Optional namespace for cross-project references (e.g., \"@auth-service\")."
    },
    "display_prefix": {
      "type": "string",
      "description": "Optional display prefix for reports (e.g., \"HP\"). Does not affect entity IDs."
    },
    "extensions": {
      "type": "array",
      "description": "The extensions that extend the entity model: a builtin or installed extension by name (`@scope/name`), or a component file (`path.wasm`, or `name=path.wasm` with the name it declares; relative to the project root).",
      "items": {
        "type": "string"
      },
      "uniqueItems": true,
      "default": []
    },
    "enhancement_policy": {
      "type": "string",
      "description": "How to resolve conflicts when two extensions enhance the same field on the same entity kind.",
      "enum": [
        "error",
        "priority",
        "namespace"
      ],
      "default": "error"
    },
    "enhancement_overrides": {
      "type": "object",
      "description": "Explicit conflict resolution for enhancement conflicts. Keys are 'entity.field' (e.g., 'behavior.layer'), values are the winning extension package name.",
      "additionalProperties": {
        "type": "string"
      }
    },
    "entity_kind_policy": {
      "type": "string",
      "description": "How to resolve conflicts when two extensions register the same entity kind name.",
      "enum": [
        "error",
        "priority",
        "namespace"
      ],
      "default": "error"
    },
    "entity_kinds": {
      "type": "object",
      "description": "Explicit conflict resolution for entity kind conflicts. Keys are kind names, values are the winning extension package name.",
      "additionalProperties": {
        "type": "string"
      }
    },
    "providers": {
      "type": "array",
      "description": "Provider configurations for external reference validation (GitHub, Jira, Figma, etc.), in declaration order: when two providers declare one scheme, the first wins (E057). Two instances of one provider use two schemes.",
      "items": {
        "$ref": "#/$defs/provider"
      }
    },
    "settings": {
      "type": "object",
      "description": "Each extension's typed settings, by extension name, then setting name (a family's key is written whole, `models.planning`). `specforge settings` lists what they resolve to; `specforge schema --config` writes this schema with every loaded extension's settings typed. A secret is never written here (E087).",
      "additionalProperties": {
        "type": "object",
        "description": "One extension's settings: a setting name to its value."
      }
    },
    "personas": {
      "type": "object",
      "description": "Persona definitions for capability validation. Keys are persona IDs.",
      "additionalProperties": {
        "$ref": "#/$defs/persona"
      }
    },
    "surfaces": {
      "type": "object",
      "description": "Surface definitions for capability validation. Keys are surface IDs.",
      "additionalProperties": {
        "$ref": "#/$defs/surface"
      }
    },
    "inference": {
      "type": "object",
      "description": "Project-level inference hints that override or append to extension defaults.",
      "additionalProperties": false,
      "properties": {
        "global": {
          "type": "string",
          "description": "Global inference source root"
        },
        "kinds": {
          "type": "object",
          "description": "Per-kind inference source roots",
          "additionalProperties": {
            "type": "string"
          }
        },
        "density_threshold": {
          "type": "number",
          "description": "Minimum entity density for inference",
          "minimum": 0,
          "maximum": 1
        }
      }
    },
    "registries": {
      "type": "array",
      "description": "Extension registries used by add/update/search/publish/login. SpecForge has no built-in registry: without this key those commands fail with E063.",
      "items": {
        "$ref": "#/$defs/registry"
      }
    }
  },
  "additionalProperties": false,
  "$defs": {
    "provider": {
      "type": "object",
      "description": "One provider instance: the ref scheme it serves, its alias, the extension that implements it, and that extension's settings.",
      "required": [
        "scheme",
        "alias",
        "extension"
      ],
      "properties": {
        "scheme": {
          "type": "string",
          "description": "The ref scheme this instance serves (e.g., \"gh\" for gh:42). Unique across providers."
        },
        "alias": {
          "type": "string",
          "description": "The instance's name (e.g., \"main\"). Unique across providers."
        },
        "extension": {
          "type": "string",
          "description": "The extension that implements the provider (e.g., \"@acme/github\"); it must be enabled in extensions."
        },
        "settings": {
          "type": "object",
          "description": "Provider-specific settings, passed to the extension as they are (e.g., {\"repo\": \"org/repo\"})."
        }
      },
      "additionalProperties": false
    },
    "persona": {
      "type": "object",
      "description": "Configuration for a single persona.",
      "required": [
        "display_name"
      ],
      "properties": {
        "display_name": {
          "type": "string",
          "description": "Human-readable name for this persona."
        },
        "description": {
          "type": "string",
          "description": "Optional description of the persona."
        }
      },
      "additionalProperties": false
    },
    "surface": {
      "type": "object",
      "description": "Configuration for a single surface.",
      "required": [
        "display_name"
      ],
      "properties": {
        "display_name": {
          "type": "string",
          "description": "Human-readable name for this surface."
        },
        "surface_type": {
          "type": "string",
          "description": "Optional type classification for this surface."
        }
      },
      "additionalProperties": false
    },
    "registry": {
      "type": "object",
      "description": "One extension registry endpoint (mirrors RegistryConfig).",
      "additionalProperties": false,
      "properties": {
        "alias": {
          "type": "string",
          "description": "Unique alias for the registry"
        },
        "url": {
          "type": "string",
          "description": "The registry's root: an http or https URL without the protocol's /v1, such as https://registry.example",
          "pattern": "^https?://[^?#]+$",
          "not": {
            "pattern": "/v1/?$"
          }
        },
        "scope_filter": {
          "type": "string",
          "pattern": "^@[a-z0-9][a-z0-9._-]*$",
          "description": "The scope (@name) whose packages this registry serves; any other value refuses every registry operation (E067)"
        },
        "default_registry": {
          "type": "boolean",
          "default": false,
          "description": "Serve every package no scope_filter matches"
        }
      },
      "required": [
        "alias",
        "url"
      ]
    }
  },
  "$comment": "Keys consumed via raw passthrough by the compiler (not typed on ProjectConfig): providers, personas, surfaces, enhancement_policy, enhancement_overrides, entity_kind_policy, entity_kinds, strict, namespace, display_prefix. 'settings' is resolved against each loaded extension's declaration (E086, E087, W166). Registry client reads 'registries'; inference is typed on ProjectConfig."
}
