{
  "$schema": "../../../schema/specforge.schema.json",
  "name": "specforge-test",
  "version": "0.1.0",
  "spec_root": ".",
  "extensions": [
    "@specforge/product",
    "@specforge/software",
    "@specforge/testing",
    "@specforge/cargo-test",
    "@specforge/governance",
    "@specforge/formal"
  ]
}
